{
  "$schema": "https://json-schema.org/draft/2020-12/schema",
  "$id": "https://lathe.dev/schema/kit_part.v1.json",
  "title": "Lathe Phase 12 Kit Part",
  "description": "Internal JSON schema for a single Phase 12 hard-surface kit-part data file. NOT a public .lth syntax. Used by lathe.asset_quality.kit_library.load_kit_library to validate per-part metadata files under std/kits/hardsurface/<category>/.",
  "type": "object",
  "additionalProperties": false,
  "required": [
    "name",
    "category",
    "kind",
    "material_zones",
    "sockets",
    "placement_constraints",
    "scale_range",
    "allowed_families",
    "lod_behavior",
    "bake_group",
    "provenance"
  ],
  "properties": {
    "name": {
      "type": "string",
      "minLength": 1,
      "description": "Globally unique kit-part identifier within the kit library."
    },
    "category": {
      "type": "string",
      "enum": ["fasteners", "corner_guards", "handles", "rails", "warning_labels"],
      "description": "MVP kit-part category. Phase 12 ships exactly five categories."
    },
    "kind": {
      "type": "string",
      "enum": ["procedural", "mesh_stub"],
      "description": "Authoring kind. Phase 12 ships only `procedural` parts; `mesh_stub` is reserved for future phases when stub mesh files are introduced."
    },
    "procedural_recipe": {
      "type": "object",
      "description": "Free-form recipe descriptor (only required when kind == 'procedural'). The schema does not validate the recipe internals beyond 'is an object' to keep authoring flexible."
    },
    "mesh_stub_uri": {
      "type": "string",
      "description": "Relative path to a mesh-stub file under std/kits/hardsurface/ (only required when kind == 'mesh_stub'). NO real meshes ship in Phase 12."
    },
    "material_zones": {
      "type": "array",
      "description": "Names of material zones the part exposes (e.g. 'painted_steel_body', 'warning_label_yellow'). Strings should align with the Phase 8 material/wear graph zone vocabulary where possible.",
      "items": {"type": "string", "minLength": 1}
    },
    "sockets": {
      "type": "array",
      "description": "List of attachment sockets. Empty array is allowed.",
      "items": {
        "type": "object",
        "additionalProperties": false,
        "required": ["name", "anchor_axis", "default_position"],
        "properties": {
          "name": {"type": "string", "minLength": 1},
          "anchor_axis": {
            "type": "string",
            "enum": ["+x", "-x", "+y", "-y", "+z", "-z"],
            "description": "Primary axis the socket anchors to."
          },
          "default_position": {
            "type": "array",
            "minItems": 3,
            "maxItems": 3,
            "items": {"type": "number"},
            "description": "Default [x, y, z] position in part-local coordinates."
          }
        }
      }
    },
    "placement_constraints": {
      "type": "object",
      "description": "Where the part may be placed on a host surface.",
      "additionalProperties": false,
      "required": ["face", "normal_axis", "requires_flat_surface"],
      "properties": {
        "face": {
          "type": "string",
          "enum": ["any", "top", "bottom", "front", "back", "left", "right"]
        },
        "normal_axis": {
          "type": "string",
          "enum": ["+x", "-x", "+y", "-y", "+z", "-z", "any"]
        },
        "requires_flat_surface": {"type": "boolean"}
      }
    },
    "scale_range": {
      "type": "object",
      "description": "Allowed scale multipliers for the part. Both > 0; max >= min.",
      "additionalProperties": false,
      "required": ["min", "max"],
      "properties": {
        "min": {"type": "number", "exclusiveMinimum": 0.0},
        "max": {"type": "number", "exclusiveMinimum": 0.0}
      }
    },
    "allowed_families": {
      "type": "array",
      "minItems": 1,
      "description": "List of family names the part is allowed on. ['*'] means all families.",
      "items": {"type": "string", "minLength": 1}
    },
    "lod_behavior": {
      "type": "object",
      "description": "How the part participates in LOD chains.",
      "additionalProperties": false,
      "required": ["strategy", "retained_for_collision"],
      "properties": {
        "strategy": {
          "type": "string",
          "enum": ["always_present", "drop_at_lod1", "drop_at_lod2", "drop_at_lod3"]
        },
        "retained_for_collision": {"type": "boolean"}
      }
    },
    "bake_group": {
      "type": "string",
      "minLength": 1,
      "description": "Bake-pass grouping identifier (e.g. 'trim_metal', 'warning_decals')."
    },
    "provenance": {
      "type": "object",
      "description": "Provenance record for the part data.",
      "additionalProperties": false,
      "required": ["source", "version", "license"],
      "properties": {
        "source": {"type": "string", "minLength": 1},
        "version": {"type": "string", "minLength": 1},
        "license": {
          "type": "string",
          "enum": ["internal", "CC0", "MIT"]
        }
      }
    }
  }
}
