{
  "name": "stamped_corner_cap",
  "category": "corner_guards",
  "kind": "procedural",
  "procedural_recipe": {
    "primitive": "stamped_three_face_cap",
    "edge_length_mm": 50.0,
    "wall_thickness_mm": 1.6,
    "stamping_radius_mm": 4.0
  },
  "material_zones": ["painted_steel_body"],
  "sockets": [
    {
      "name": "corner_anchor",
      "anchor_axis": "+y",
      "default_position": [0.0, 0.0, 0.0]
    }
  ],
  "placement_constraints": {
    "face": "any",
    "normal_axis": "any",
    "requires_flat_surface": false
  },
  "scale_range": {"min": 0.9, "max": 1.3},
  "allowed_families": ["industrial_crate", "supply_container"],
  "lod_behavior": {
    "strategy": "drop_at_lod2",
    "retained_for_collision": true
  },
  "bake_group": "corner_guard_metal",
  "provenance": {
    "source": "std/kits/hardsurface (Phase 12 internal)",
    "version": "v1",
    "license": "internal"
  }
}
