{
  "name": "hex_bolt_m6",
  "category": "fasteners",
  "kind": "procedural",
  "procedural_recipe": {
    "primitive": "hex_prism_with_threaded_shank",
    "head_diameter_mm": 10.0,
    "head_height_mm": 4.0,
    "shank_diameter_mm": 6.0,
    "shank_length_mm": 18.0,
    "thread_pitch_mm": 1.0
  },
  "material_zones": ["bare_metal_fastener"],
  "sockets": [
    {
      "name": "shank_anchor",
      "anchor_axis": "-z",
      "default_position": [0.0, 0.0, 0.0]
    }
  ],
  "placement_constraints": {
    "face": "any",
    "normal_axis": "any",
    "requires_flat_surface": true
  },
  "scale_range": {"min": 0.8, "max": 1.4},
  "allowed_families": ["industrial_crate", "service_cabinet", "control_pedestal"],
  "lod_behavior": {
    "strategy": "drop_at_lod2",
    "retained_for_collision": false
  },
  "bake_group": "trim_metal",
  "provenance": {
    "source": "std/kits/hardsurface (Phase 12 internal)",
    "version": "v1",
    "license": "internal"
  }
}
