{
  "name": "welded_steel_l_bracket",
  "category": "corner_guards",
  "kind": "procedural",
  "procedural_recipe": {
    "primitive": "right_angle_l_bracket",
    "leg_length_mm": 60.0,
    "leg_thickness_mm": 3.5,
    "weld_seam_mm": 2.0,
    "edge_chamfer_mm": 1.0
  },
  "material_zones": ["painted_steel_body", "dark_bare_metal_underlayer"],
  "sockets": [
    {
      "name": "corner_anchor",
      "anchor_axis": "+y",
      "default_position": [0.0, 0.0, 0.0]
    },
    {
      "name": "fastener_socket_a",
      "anchor_axis": "-z",
      "default_position": [0.015, 0.0, 0.0]
    },
    {
      "name": "fastener_socket_b",
      "anchor_axis": "-z",
      "default_position": [-0.015, 0.0, 0.0]
    }
  ],
  "placement_constraints": {
    "face": "any",
    "normal_axis": "any",
    "requires_flat_surface": false
  },
  "scale_range": {"min": 0.85, "max": 1.4},
  "allowed_families": ["industrial_crate", "supply_container", "service_cabinet"],
  "lod_behavior": {
    "strategy": "drop_at_lod3",
    "retained_for_collision": true
  },
  "bake_group": "corner_guard_metal",
  "provenance": {
    "source": "std/kits/hardsurface (Phase 12 internal)",
    "version": "v1",
    "license": "internal"
  }
}
